{
  "$schema": "../../../schemas/case.schema.json",
  "caseId": "institutional-sacrificial-escalation",
  "title": "Institutional Self-Preservation Through Sacrificial Escalation",
  "researchQuestion": "When a political institution treats prior deaths as an obligation to continue a destructive course, which forms of agency are necessary to explain the resulting behavior?",
  "status": "scaffold",
  "scope": "Methodological pilot using a bounded rhetorical and institutional pattern rather than a completed historical judgment.",
  "timePeriod": {
    "start": "1863",
    "end": "open-comparative"
  },
  "geography": [
    "United States",
    "comparative cases to be added"
  ],
  "traditionLensIds": [
    "wink-powers",
    "stringfellow-institutional-survival",
    "ellul-technique",
    "social-ontology",
    "critical-realism",
    "heiser-supernatural-worldview"
  ],
  "createdBy": "human",
  "reviewStatus": "draft",
  "publicationStatus": "private-note",
  "notes": "Pilot records test the workflow rather than settle the case."
}
